Question_Title,Question_ID,Author_Name,Author_ID,Author_Rep,Question_Post_Time,Question_Score,Number_Of_Views,Number_Of_Answers,Number_Of_Comments,"Edited,","Answer_Accepted,",Tags,Question_Closed
Design pattern for scheduling method calls (open-loop control) [duplicate],441245,Escher,165741,195,2022-09-25 12:53:25,1,41,0,3,True,False,"['design-patterns', 'architectural-patterns', 'enterprise-architecture', 'scheduling']",False
Must the use cases extend the entities in Clean Architecture?,441243,Takesi Tokugawa YD,375105,173,2022-09-25 07:25:43,0,479,1,2,False,True,"['use-case', 'clean-architecture']",False
Which Clean Architecture Areas do Gateways interfaces and their implementations belong to?,441230,Takesi Tokugawa YD,375105,173,2022-09-24 07:15:57,0,302,2,10,True,True,"['interfaces', 'clean-architecture']",False
Proper orchestration of NServiceBus sagas,441223,Scott Hannen,219616,921,2022-09-23 19:35:15,0,91,1,0,False,False,"['c#', '.net']",False
Multi-tenant monolith splitting - Handling interactions with third party apis,441222,munkee,75793,131,2022-09-23 19:19:22,0,56,2,3,False,False,['microservices'],False
Writing apps for Android and Apple phone simultaneously,441214,Trey Freeman,420845,3,2022-09-23 12:53:02,0,65,1,2,False,True,"['android', 'app', 'apple']",False
One API used by multiple clients without causing overhead,441212,Ahsan,420867,101,2022-09-23 10:51:37,0,87,0,0,True,False,"['web', 'applications']",False
Interface segregation principle,441205,Antonio Gamiz Delgado,349631,431,2022-09-23 07:54:42,2,199,1,0,False,True,"['design', 'object-oriented-design', 'interfaces', 'solid']",False
Multiple steps of mutations in one function - how to refactor?,441198,filemono,359879,113,2022-09-22 21:32:27,1,113,2,1,False,True,['design-patterns'],False
Is there a text distance (or string similarity) algorithm which accounts for the distance between characters?,441195,Vermillion,221704,159,2022-09-22 20:56:41,-1,140,3,3,True,False,"['strings', 'text-processing', 'string-matching']",False
update state with the rest of properties or to have an action only to update the state?,441188,Álvaro García,412921,287,2022-09-22 11:49:14,0,60,2,2,False,False,['domain-driven-design'],False
Best practices when it comes to extending Service collections in .NET for dependency injection,441184,Robin,160839,111,2022-09-22 08:00:10,1,53,0,0,True,False,"['c#', '.net', 'dependency-injection']",False
DDD can part of the domain be found in infrastructure?,441182,Ced,196981,276,2022-09-22 01:42:29,2,217,2,4,True,True,['domain-driven-design'],False
Clean architecture - modelling the domain,441181,Jack Deeth,255865,101,2022-09-22 00:52:01,0,52,0,0,False,False,['clean-architecture'],False
What are the considerations between a class variable and a global variable,441174,charmoniumQ,420787,121,2022-09-21 18:20:22,1,229,2,1,True,True,"['design', 'design-patterns', 'object-oriented', 'object-oriented-design']",False
Is it a bad practice to use cookies for a Desktop Application?,441171,Hicham Zouarhi,310708,111,2022-09-21 16:06:35,0,180,1,6,False,True,"['desktop-application', 'cookies', 'load-balancing']",False
Angular2 architecture: Sending runtime data updates to components,441168,Gianluca Ghettini,184991,113,2022-09-21 09:53:10,1,16,0,3,True,False,"['design-patterns', 'angular2']",False
Making a Data Layer that is tightly coupled to the Presentation Layer in Clean Architecture,441167,Bawenang Rukmoko Pardian Putra,355943,211,2022-09-21 09:07:54,0,176,2,4,False,True,"['clean-architecture', 'coupling']",False
Dependency Injection vs Static Dependencies,441157,EspressoCoder,419839,51,2022-09-20 19:00:36,2,783,2,1,False,True,"['java', 'dependency-injection', 'inversion-of-control', 'java8', 'static']",False
Am I making this web app right?,441152,moosepowa,420726,1,2022-09-20 15:47:37,0,87,1,0,False,False,"['database', 'python', 'web-applications', 'sql', 'postgres']",False
What are the existing theories or methodologies around synchronizing tree structures?,441151,Deane,230046,171,2022-09-20 15:47:14,3,146,3,10,False,False,"['data-structures', 'synchronization']",False
Why do HTML and JS feel slow on smartphones? What could be changed to make them faster? [closed],441146,jokoon,5024,2266,2022-09-20 13:13:59,-1,109,1,7,False,True,"['architecture', 'html', 'rendering', 'file-formats']",True
Use factory design pattern to create a specific object,441141,dafie,420706,109,2022-09-20 11:16:04,0,47,1,4,False,False,"['design-patterns', 'factory']",False
Allow\disallow actions in one system based on the state of another,441140,JaktensTid,396380,129,2022-09-20 10:58:45,2,62,1,0,False,False,"['design', 'design-patterns', 'object-oriented-design']",False
How best to keep Excel Workbook field in sync across class instances,441139,Mike Warren,307482,226,2022-09-20 07:59:18,2,74,1,2,False,True,"['synchronization', 'file-handling', 'excel']",False
Design Pattern: How to handle changing format of text file?,441135,Selva,387640,129,2022-09-20 05:00:41,2,232,2,2,False,False,"['design-patterns', 'python', 'domain-driven-design']",False
Shared logic to different types,441134,ParkCheolu,373807,111,2022-09-20 01:59:22,0,106,2,17,True,True,"['design-patterns', 'object-oriented-design']",False
Do we really need a message brocker in WebSocket system?,441132,vusra,420681,9,2022-09-19 21:57:39,0,73,0,2,True,False,"['architecture', 'web-applications', 'message-queue', 'scalability', 'websockets']",False
HTML Playground [closed],441125,christo,420667,105,2022-09-19 15:40:40,-3,68,1,4,False,True,"['javascript', 'security', 'html', 'customization']",True
Is it Good Practice to Only Expose Interfaces,441123,Bondolin,180349,403,2022-09-19 15:23:36,29,8000,3,10,True,True,"['c#', 'object-oriented', 'api-design', 'interfaces', 'factory']",False
Modularity vs pure functions,441122,deSKase,402483,149,2022-09-19 12:16:49,3,248,2,0,False,True,"['functional-programming', 'modules']",False
How is B-Tree used in DBMS-s if WHERE condition can be anything?,441115,Vega TV,420643,111,2022-09-19 03:00:18,0,153,1,1,True,True,"['database', 'data-structures', 'rdbms', 'dbms']",False
Guidance on rectifying a minor bump that should have been a major bump,441114,user2218154,420642,139,2022-09-19 02:40:42,12,3000,4,6,True,True,"['versioning', 'semantic-versioning']",False
What does the 4th line of this pseudocode mean? [closed],441107,jokoon,5024,2266,2022-09-18 13:55:00,-2,199,1,0,True,False,"['algorithms', 'c', 'game-development', 'graph', 'puzzles']",True
"How could creating symlinks/aliases to files on S3 work, while still taking advantage of CDN optimizations?",441103,Lance,73722,2467,2022-09-18 10:56:24,0,77,1,0,False,False,"['architecture', 'http', 'aws', 'file-storage', 'cdn']",False
Deploy C#/C++ binaries incrementally by patching the difference,441102,sɐunıɔןɐqɐp,305860,233,2022-09-18 09:43:31,12,2000,2,3,True,True,"['windows', 'deployment', 'devops', 'installer', 'software-patches']",False
What is the term used to describe the number of times a pointer can be dereferenced?,441097,vim_overlord,420611,69,2022-09-18 00:48:00,6,174,1,1,False,False,"['terminology', 'pointers', 'semantics', 'reference']",False
Should modifying a hash function be considered a breaking change?,441091,Calvin Godfrey,420604,133,2022-09-17 16:56:28,0,351,6,2,True,False,['semantic-versioning'],False
std::string_view and std::string in utility library interface,441085,Stefan Riedel,420593,111,2022-09-17 11:26:32,0,151,2,1,True,True,['c++'],False
User Experience for Fraud Detection [closed],441082,user1767270,82970,303,2022-09-17 04:16:04,-2,55,1,1,False,False,"['user-experience', 'users']",True
Best approach for several steps with user input in between,441079,Rick Wolff,380783,123,2022-09-16 21:20:31,2,66,0,2,False,False,"['design-patterns', '.net', 'winforms']",False
Best practise for designing REST API endpoint that accepts a nested resource POST,441075,user2190492,352709,331,2022-09-16 14:28:17,2,99,1,1,True,False,"['rest', 'api', 'api-design', 'data-structures', 'http']",False
Does it make sense to use the word 'Set' in a class as an umbrella term for both sets and individual items?,441065,user6490576,313410,67,2022-09-15 22:07:30,3,244,4,1,True,True,"['object-oriented', 'naming-standards']",False
Modelling Interfaces provided by different IPC frameworks,441053,Jens,416415,1,2022-09-15 09:11:30,0,49,0,0,True,False,"['architecture', 'middleware']",False
Operating two independent and competing clusters?,441035,LordOfThePigs,57566,1101,2022-09-14 07:32:18,0,98,1,3,True,False,"['distributed-system', 'cloud-computing', 'cluster']",False
Problem statement for code reuse [closed],441034,Arnon Axelrod,300983,163,2022-09-14 05:47:36,3,167,2,5,True,False,"['agile', 'code-reuse', 'user-story', 'technical-debt']",True
Large Inheritance Hierarchy vs. One Object With Many Nullable Fields,441028,Treker,419624,161,2022-09-13 16:40:05,3,293,3,6,True,True,"['object-oriented', 'inheritance', 'null']",False
Is websocket connection a driving adapter or driven adapter in hexagonal architecture,441023,Muhammad Saboor,412079,31,2022-09-13 15:13:19,2,169,1,2,False,True,"['architecture', 'domain-driven-design', 'websockets', 'hexagonal-architecture']",False
Refactor to object oriented style and use design patterns,441021,Happy Coder,420391,101,2022-09-13 14:11:33,0,143,2,1,False,False,"['design', 'design-patterns', 'object-oriented', 'object-oriented-design']",False
Benchmarking C# code - results,441009,Martin Maat,209665,17500,2022-09-12 20:50:26,3,174,1,5,True,False,"['cpu', 'benchmarking']",False
"How form SAFe teams within ART, when people have non-overlapping skills?",441006,Robert Skarżycki,420367,109,2022-09-12 19:39:02,0,144,3,3,True,False,"['agile', 'scaled-agile-framework']",False
How to get the information from another root entity to validate some operation?,441001,Álvaro García,412921,287,2022-09-12 15:55:45,0,61,1,2,False,False,['domain-driven-design'],False
How to refactor this code to obey the ‘open-closed’ principle?,440990,Abner,420191,71,2022-09-12 07:57:37,6,1000,5,10,True,True,"['java', 'software', 'open-closed-principle', 'open-close']",False
Is it OK to use a Command Sourcing instead of Event Sourcing? Replay events in Commands-Repositories,440987,Augusto Will,385961,97,2022-09-12 05:41:20,-2,108,1,0,False,False,"['architecture', 'domain-driven-design', 'architectural-patterns', 'enterprise-architecture', 'clean-architecture']",False
Microservice Storage Architecture for multiple Storage Backends,440981,lagmoellertim,328303,1,2022-09-11 15:00:27,0,38,0,3,False,False,"['microservices', 'storage', 'jwt']",False
"Within the same computer, what is the difference between API and IPC?",440980,Noob_Guy,397757,149,2022-09-11 14:27:55,-1,386,7,2,False,False,"['api', 'software', 'operating-systems', 'applications']",False
Intraservice Communication Using Kafka,440977,Gitonga Tosh,349125,1,2022-09-11 12:34:15,0,44,1,0,True,False,"['architectural-patterns', 'backend']",False
What is the big O of this algorithm? [duplicate],440973,james pow,420289,103,2022-09-10 21:20:43,-4,105,1,0,False,True,"['algorithms', 'complexity', 'big-o']",False
Is the fluent interface pattern suitable in casual scenarios?,440969,Daniele Repici,373658,181,2022-09-10 15:24:21,7,801,4,1,False,True,"['java', 'method-chaining']",False
Why does this activity diagram not have the same amount of paths as the cyclomatic complexity number?,440966,Alfred Kaminski,420271,43,2022-09-10 07:31:19,3,291,1,3,True,True,"['unit-testing', 'cyclomatic-complexity']",False
Any way to forward an auth session from OAuth system to another system (with API key)?,440959,CAJE,420251,1,2022-09-09 15:58:45,0,137,1,2,False,True,"['authentication', 'docker', 'oauth']",False
Service Bus Handlers Direct Access to DB vs Api,440949,Yorro,83102,151,2022-09-09 09:04:40,0,44,0,0,True,False,"['microservices', 'message-queue', '.net-core', 'service-bus']",False
Is it okay for an Interface Adapter / Repository / Gateway to use Entities in its implementation,440948,Bawenang Rukmoko Pardian Putra,355943,211,2022-09-09 08:04:20,0,408,2,4,True,True,"['clean-architecture', 'entity', 'swift-language']",False
Best practice for git repo locations,440933,confused_nomad,420198,19,2022-09-08 14:27:47,-1,243,1,0,False,True,"['git', 'server', 'repository']",False
Any established convention on symbols to use as multi-level separators? [closed],440932,hb20007,157676,109,2022-09-08 14:16:51,-1,130,2,1,True,True,['coding-style'],True
Microservice replica sync,440920,djflex68,420178,51,2022-09-08 09:20:39,4,163,2,6,False,True,"['architecture', 'domain-driven-design', 'microservices']",False
Abstracting calls to common library methods in C#,440917,Der_Reparator,420177,41,2022-09-08 08:36:34,3,182,2,3,True,True,"['c#', 'unit-testing', 'dependency-injection', 'inversion-of-control']",False
Defining SLI / SLO for ETL and Reporting Application,440914,Ravi Parekh,420165,31,2022-09-08 04:02:40,2,71,1,4,False,False,"['google', 'devops', 'monitoring', 'system-reliability']",False
"REST API design for resource that is ""uploaded"" via Presigned URL",440910,obaqueiro,180978,157,2022-09-07 21:15:27,0,91,1,1,False,False,"['rest', 'api', 'api-design']",False
How to separate UI and business logic when they are intertwined by design,440905,user2195738,397914,43,2022-09-07 18:26:35,0,272,2,0,False,True,"['architecture', 'user-interface', 'layers', 'separation-of-concerns', 'angular']",False
Declarative name for function with multi-purpose-loop from broken-up monolithic function [closed],440897,Incubbus,346681,97,2022-09-07 10:19:21,-3,83,1,10,False,True,"['naming', 'loops']",True
Model Driven Engineering vs. User Centered Design,440891,Liandri,420112,23,2022-09-07 00:16:39,-1,77,1,7,False,True,"['domain-model', 'user-interface', 'user-experience']",False
Best practices: Clarity vs. confidence in code behavior,440887,Matthew Souther,419355,477,2022-09-06 21:18:03,36,8000,11,4,False,False,['coding-style'],False
Coffee machine strategy pattern implementation,440886,Gullit,420108,13,2022-09-06 20:56:13,0,202,2,0,False,True,"['design-patterns', 'object-oriented', 'object-oriented-design', 'strategy', 'strategy-pattern']",False
Git-flow: How to create a hotfix release when there are future releases?,440863,buhtz,198281,139,2022-09-06 12:18:35,0,481,2,2,False,True,"['git', 'gitflow']",False
What alternatives exist to providing clients estimates for a software agency? [closed],440858,tsvallender,420080,207,2022-09-06 11:08:08,9,2000,6,2,False,False,['project-management'],True
Managing a project with an unfamilar programming language,440856,Gergely,125930,131,2022-09-06 10:38:46,-3,201,1,17,True,False,"['programming-languages', 'project-management']",False
Where to create repository instances?,440854,Mr. B.,166774,143,2022-09-06 09:54:08,0,129,1,2,True,False,"['design', 'design-patterns', 'architecture', 'python', 'clean-code']",False
Should an optional boolean function argument rather default to true or false?,440851,DaveFar,29043,1386,2022-09-06 07:32:26,5,785,5,4,False,True,"['coding-style', 'coding-standards', 'conventions', 'default-values']",False
Middleware with parameters and dependencies,440847,r32,420057,3,2022-09-06 02:54:31,0,66,1,10,True,True,"['design-patterns', 'middleware']",False
"Inheritance/Composition VS ""Direct Injection Construction""",440845,Robin Kreuzer,347781,153,2022-09-06 00:29:43,1,227,2,0,False,False,"['object-oriented', 'dependency-injection', 'inheritance', 'composition', 'construction']",False
Is it okay for a POST response to return resources other than those in the request?,440839,Don Draper,339572,135,2022-09-05 16:09:50,1,98,2,1,True,False,"['design', 'rest', 'api', 'api-design']",False
Is API exactly the same as header file?,440818,Noob_Guy,397757,149,2022-09-04 07:46:40,0,315,4,6,True,False,"['c', 'api', 'libraries']",False
How do non-RAII languages free resources during stack unwinding?,440816,Vorac,54268,6985,2022-09-04 06:55:15,20,4000,4,0,True,True,"['java', 'python', 'exceptions']",False
"Is it preferable to embed "".qm"" translation files with Qt Resource System or bundling it with PyInstaller?",440813,Giovanni L,343604,1,2022-09-03 22:09:37,0,61,0,0,False,False,"['python', 'qt']",False
How do I choose a versioning scheme when Semantic Versioning (SemVer) isn't appropriate?,440811,David Cary,631,1352,2022-09-03 19:22:24,7,931,2,3,True,False,"['versioning', 'semantic-versioning']",False
the actual notion of an integration and end to end testing,440807,mleko,419962,47,2022-09-03 16:38:18,3,153,2,1,False,False,"['testing', 'integration-testing']",False
Git flow for multiservice monorepo,440798,linethepanic,419943,39,2022-09-02 17:58:01,3,265,2,2,True,False,"['git', 'release-management', 'gitflow']",False
Is it possible to instantiate a template class at runtime?,440796,Xie Qing,419888,9,2022-09-02 16:24:58,0,470,3,1,True,False,"['c++', 'class', 'templates', 'runtime']",False
How to design an ever evolving entity while offering backward compatibility,440791,Der,419935,109,2022-09-02 14:20:52,0,71,1,1,False,False,['architecture'],False
Long polling and resource use,440789,Magnus,120703,405,2022-09-02 13:40:42,0,35,0,2,False,False,"['php', 'networking', 'client-server', 'polling', 'push']",False
"When mocking a class in a unit test, how should I handle dependency classes that have multiple similar get methods?",440787,krazune,419929,41,2022-09-02 13:09:48,4,383,5,1,True,False,"['unit-testing', 'testing', 'mocking']",False
Can you have too much unit test coverage?,440778,OutstandingBill,243626,282,2022-09-02 04:10:42,8,812,10,1,True,False,['unit-testing'],False
"To maintain SOLID, should data preparation, conversion, and pre-computation for purposes of saving an object, be separate from data persistence layer?",440772,Dennis,119333,8079,2022-09-01 18:25:48,2,151,2,0,True,True,"['object-oriented', 'php', 'solid', 'layers', 'separation-of-concerns']",False
Java Library - How to do Pure Dependency Injection When State is a Factor?,440757,EspressoCoder,419839,51,2022-08-31 20:38:46,1,232,3,3,True,True,"['java', 'design-patterns', 'object-oriented-design', 'dependency-injection', 'state']",False
Optimizing a string to enum converter [closed],440750,HFOrangefish,419774,151,2022-08-31 14:36:15,0,393,3,5,True,True,"['c++', 'clean-code', 'optimization', 'enum']",True
What is the best way to design endpoints for a restful application?,440749,RoyalGoose,409597,125,2022-08-31 13:40:27,0,61,0,6,True,False,"['rest', 'api-design', 'backend']",False
"Data backup/slave node with replicated data, to be writeable while master is offline",440739,TomCrow,419817,11,2022-08-31 07:56:14,0,71,1,2,False,True,"['database', 'web-applications', 'synchronization', 'data-replication', 'mariadb']",False
How can I efficiently diff a CSV file against a database?,440736,Isvara,54726,610,2022-08-31 04:11:03,14,6000,5,1,False,True,"['caching', 'distributed-system', 'postgres']",False
How to store multiple-users authorization tokens from a single service if I can't use a persistent storage?,440735,Guillermo Leon Rodriguez,419813,1,2022-08-31 02:51:59,0,73,0,5,True,False,"['design', 'python', 'web-applications', 'django']",False
microservice separate data server auth server an website,440719,Sherif Awad,419777,1,2022-08-30 09:38:26,0,44,0,3,True,False,"['microservices', 'authentication', 'separation-of-concerns']",False
Alternatives to if-else on data reading,440718,HFOrangefish,419774,151,2022-08-30 09:24:52,3,2000,5,2,False,True,"['c++', 'coding-style', 'clean-code']",False
What is the lib/ or library/ directory for? [closed],440716,david_adler,343361,91,2022-08-30 09:02:04,-5,84,1,10,True,False,"['ios', 'ruby-on-rails', 'directory-structure']",True
Why session should be a param when you write a query function?,440709,Tlaloc-ES,327557,387,2022-08-29 21:27:03,0,160,2,0,False,True,"['database', 'libraries', 'patterns-and-practices', 'functions']",False
Design pattern for feature toggling,440708,Serberuss,94236,129,2022-08-29 20:39:25,0,243,3,3,False,False,"['design', 'c#', 'design-patterns', 'api']",False
Branch management when you cannot merge due to holidays,440699,Eike Schulte,27107,127,2022-08-29 07:57:11,0,190,1,2,False,True,"['git', 'gitlab']",False
What to name a POST endpoint that behaves like GET?,440688,Chris,419258,53,2022-08-28 23:42:24,4,447,3,0,True,True,"['rest', 'naming']",False
Is there a standard for describing information about Java Beans (Bean Introspections),440678,Chris,89164,207,2022-08-28 08:24:02,0,71,0,0,False,False,"['java', 'standards', 'industry-standard']",False
am I understanding MVVM correctly? [duplicate],440667,Saketh,419673,9,2022-08-27 10:27:26,0,86,1,1,False,False,"['design-patterns', 'android', 'mvvm', 'android-development']",False
How would I use TDD / BDD when my webapp interacts with an external REST API?,440663,Lagerbaer,161522,516,2022-08-27 03:43:15,2,154,2,3,True,True,"['rest', 'web-applications', 'tdd', 'bdd']",False
Correct IHttpClientFactory implementation with dependency injection?,440657,chrisxfire,418147,121,2022-08-26 16:43:50,1,479,1,2,False,True,"['c#', '.net', 'dependency-injection']",False
API Routes: Get App by User or Get User's App,440656,RoLYroLLs,287452,129,2022-08-26 15:51:57,1,74,1,0,True,True,"['api-design', 'asp.net-mvc-web-api']",False
"How do I handle malformed compressed input data, which crashes external library?",440646,MPIchael,365797,219,2022-08-26 09:32:20,8,792,4,4,True,True,['third-party-libraries'],False
Restricting access to resources by source and destination IP,440641,jake_berenson,419629,1,2022-08-26 08:26:06,0,39,0,0,False,False,"['design', 'networking', 'system']",False
Is It Considered Good Practice to Use Dependency Injection with Strategies from a NuGet Package?,440637,Treker,419624,161,2022-08-26 05:03:50,1,515,3,1,True,True,"['c#', 'dependency-injection', 'asp.net-core', 'nuget', 'strategy-pattern']",False
Coding style for a micro-service across organisation [closed],440629,Rishikesh Dhokare,293554,113,2022-08-25 20:53:20,-3,89,2,6,False,False,"['architecture', 'microservices', 'architectural-patterns', 'clean-architecture', 'hexagonal-architecture']",True
Approaches to 'promoting' release candidates in Java projects,440626,daniel purdew,396817,13,2022-08-25 19:45:33,0,81,1,3,True,True,"['java', 'publications']",False
Rapid rate of merging new code with minimal testing [closed],440625,rubunu,418322,7,2022-08-25 19:32:05,-1,72,2,4,False,False,"['git', 'bug', 'merging']",True
Does Jenkins essentially function like a package manager for your software product?,440619,Noob_Guy,397757,149,2022-08-25 12:42:06,-4,98,2,1,False,True,"['continuous-integration', 'packages', 'continuous-delivery', 'automation', 'jenkins']",False
How does a JIT compiler actually emit and then call the emitted native code?,440610,AIWalker,380934,1277,2022-08-25 05:42:30,5,376,3,0,False,True,"['compiler', 'assembly', 'interpreters', 'jit']",False
"High level abstraction of file scanning service in domain driven design, and the implementations",440605,Patrick Christie,418672,77,2022-08-24 22:52:24,3,80,1,10,False,False,"['domain-driven-design', 'clean-architecture', 'backend']",False
Spring Boot - How to return mocked data based on spring profile,440604,dbnex14,236377,119,2022-08-24 22:47:34,0,165,1,7,False,True,"['spring', 'spring-boot']",False
SQL databases - what will happen if dozen of users edit the same record at the same time?,440595,stubborn,362441,63,2022-08-24 14:53:55,0,138,1,4,False,False,"['database', 'concurrency']",False
What is the significance of reaching major version 1.0.0?,440591,spinners,245057,555,2022-08-24 12:45:30,42,9000,5,0,False,True,['versioning'],False
Composite ID in hierarchical REST API,440588,Robus,24288,157,2022-08-24 11:04:22,4,421,4,2,False,False,"['rest', 'api-design']",False
Best practice for knowing the link between binaries (*.exe and *.dll) and their source code?,440586,Dominique,250257,1699,2022-08-24 10:31:26,-1,218,4,2,False,True,"['git', 'visual-studio', 'release-management', 'configuration-management']",False
Should you pass an instance of service to a model class?,440585,aarnaut,297673,249,2022-08-24 10:05:59,2,127,2,17,True,False,"['design', 'object-oriented', 'model']",False
Why should I map external IDs to internal IDs in my API?,440579,David Klempfner,109967,299,2022-08-23 23:16:17,5,563,1,2,True,True,['api-design'],False
development environment for C++ GUI applications,440568,tom,364273,129,2022-08-23 15:23:02,-1,96,1,4,False,True,"['development-process', 'gui', 'third-party-libraries', 'cmake']",False
how to leverage overloading while keeping business logic out of models,440555,dbrewster,419467,139,2022-08-22 17:28:27,2,187,3,10,True,True,"['java', 'object-oriented', 'polymorphism', 'separation-of-concerns']",False
User's comment field on a row in relational databases,440541,jiwopene,344406,191,2022-08-21 16:27:32,2,180,3,0,False,False,"['database-design', 'relational-database', 'null']",False
Is MVC a sensible design choice for a CLI application?,440527,Yoh,419134,51,2022-08-20 22:10:16,0,280,2,1,True,False,"['design', 'java', 'architecture', 'mvc', 'command-line']",False
"DDD, Isn't `User` the aggregate root most of the time?",440521,Ced,196981,276,2022-08-20 11:41:08,0,602,2,6,True,True,['domain-driven-design'],False
How to optimize average rating calculation in a review system?,440519,Sadman Muhib Samyo,419381,117,2022-08-20 09:41:56,0,213,1,0,True,False,"['optimization', 'message-queue', 'async', 'review']",False
"Waiting until end of project to remove commented out code, remove unused code, and resolve compiler warnings",440511,user8297969,343245,233,2022-08-19 16:33:43,3,388,6,0,False,False,"['development-process', 'anti-patterns', 'comments', 'engineering', 'warnings']",False
